,Data,Alagamento,Bairro,Tipo,Horário Inicial,Horário Final,Endereço,Sentido,Referência
231,2023-02-07,1,Santo Amaro,Inativo Intransitável,16:16,20:57,AV VITOR MANZINI, CENTRO/BAIRRO, PTE SANTO DIAS DA SILVA
232,2023-02-07,1,Santo Amaro,Inativo Transitável,16:20,20:19,AV DAS NACOES UNIDAS, INTERLAGOS/CASTELO, R JAIME DE OLIVEIRA SOUZA
233,2023-02-07,1,Santo Amaro,Inativo Intransitável,17:08,17:15,AV VITOR MANZINI, BAIRRO/CENTRO, R CRISTALINO ROLIM DE FREITAS
234,2023-02-07,1,Santo Amaro,Inativo Intransitável,18:33,20:58,R GALENO DE CASTRO, AMBOS, AV VITOR MANZINI
235,2023-02-07,1,Santo Amaro,Inativo Intransitável,18:43,18:48,AV ROQUE PETRONI JUNIOR, MARGINAL/DIADEMA, R CANCIONEIRO POPULAR
236,2023-02-07,1,Ipiranga,Inativo Intransitável,15:06,19:37,R DOS PATRIOTAS, UNICO, AV DO ESTADO
237,2023-02-07,1,Ipiranga,Inativo Intransitável,15:10,17:00,R CISPLATINA, AMBOS, R LINO COUTINHO
238,2023-02-07,1,Ipiranga,Inativo Intransitável,15:24,20:07,R TABOR, AMBOS, AV TERESA CRISTINA
239,2023-02-07,1,Ipiranga,Inativo Intransitável,16:44,17:06,R MIL OITOCENTOS E VINTE E DOIS, UNICO, R BRIG JORDAO
240,2023-02-07,1,Ipiranga,Inativo Intransitável,16:53,17:06,R MIL OITOCENTOS E VINTE E DOIS, NAO INFORMADO, R BRIG JORDAO
241,2023-02-07,1,Ipiranga,Inativo Intransitável,17:00,17:31,R ALENCAR DE ARARIPE, AMBOS, R SALVADOR PIRES DE LIMA
242,2023-02-07,1,Vila Mariana,Inativo Transitável,15:04,17:15,:04 a 17:15AV VINTE E TRES DE MAIO, SANTANA/AEROPORTO, R PEDROSO
243,2023-02-07,1,Vila Mariana,Inativo Intransitável,15:19,20:09,AV VINTE E TRES DE MAIO, AEROPORTO/SANTANA, VD GAL EUCLIDES DE FIGUEIREDO
244,2023-02-07,1,Vila Mariana,Inativo Intransitável,15:38,17:31,AV VINTE E TRES DE MAIO, AMBOS, VD GAL EUCLIDES DE FIGUEIREDO
245,2023-02-07,1,Vila Mariana,Inativo Intransitável,15:46,17:14,AV STO AMARO, AMBOS, AV ROQUE PETRONI JUNIOR
246,2023-02-07,1,Vila Mariana,Inativo Intransitável,15:52,16:20,AV JAMARIS, UNICO, AL IRAE
247,2023-02-07,1,Vila Mariana,Inativo Intransitável,16:02,16:33,AV IBIRAPUERA, BAIRRO/CENTRO, AV JANDIRA
248,2023-02-12,1,Casa Verde,Inativo Intransitável,18:16,18:40,AV ANTONIO MUNHOZ BONILHA, AMBOS, AV NSRA.DO O
249,2023-02-12,1,Pinheiros,Inativo Transitável,16:41,17:45,AV DAS NACOES UNIDAS, CENTRO/BAIRRO, PTE OCTAVIO FRIAS DE OLIVEIRA
250,2023-02-12,1,Itaquera,Inativo Intransitável,16:31,17:21,AV ITAQUERA, AMBOS, R CAMPINAS DO PIAUI
251,2023-02-12,1,Santo Amaro,Inativo Intransitável,15:41,16:53,AV DAS NACOES UNIDAS, INTERLAGOS/CASTELO, R JAIME DE OLIVEIRA SOUZA
252,2023-02-12,1,Santo Amaro,Inativo Intransitável,16:22,17:48,AV DAS NACOES UNIDAS, INTERLAGOS/CASTELO, PTE ENG ROBERTO ROSSI ZUCCOLO
253,2023-02-12,1,Santo Amaro,Inativo Intransitável,16:24,18:14,AV ROQUE PETRONI JUNIOR, MARGINAL/DIADEMA, AV STO AMARO
254,2023-02-12,1,Santo Amaro,Inativo Intransitável,16:36,17:27,AV DAS NACOES UNIDAS, INTERLAGOS/CASTELO, R FLORIDA
255,2023-02-12,1,Santo Amaro,Inativo Intransitável,16:37,17:27,R HUNGRIA, INTERLAGOS/CASTELO, AV DAS NACOES UNIDAS
256,2023-02-12,1,Vila Mariana,Inativo Intransitável,16:26,16:52,AV DOS BANDEIRANTES, IMIGRANTES/MARGINAL, VD DOS BANDEIRANTES-DR ANTONIO MARCONDES DE ALMEIDA
257,2023-02-12,1,Vila Mariana,Inativo Intransitável,16:31,17:27,AV VINTE E TRES DE MAIO, AMBOS, VD GAL EUCLIDES DE FIGUEIREDO
258,2023-02-12,1,Vila Mariana,Inativo Intransitável,16:47,17:35,AV DOS BANDEIRANTES, AMBOS, AV STO AMARO
259,2023-02-13,1,Itaquera,Inativo Transitável,19:20,21:13,RUA JOSÉ VIEIRA GUIMARÃES, AMBOS, RUA GUABIROBA DE MINAS
260,2023-02-13,1,Itaim Paulista,Inativo Intransitável,19:21,20:44,AV MANUEL BARBALHO DE LIMA, AMBOS, AV. MAL. TITO
261,2023-02-13,1,São Miguel Paulista,Inativo Intransitável,19:30,20:56,AV MAL TITO, AMBOS, R GENDIROBA
262,2023-02-13,1,São Miguel Paulista,Inativo Intransitável,20:17,20:55,R ASDRUBAL, NAO INFORMADO, R ENG JOSE CRUZ DE OLIVEIRA
263,2023-02-15,1,Santana,Inativo Transitável,15:41,17:13,R DR CESAR, AMBOS, R SALETE (SANTANA)
264,2023-02-15,1,Itaquera,Inativo Intransitável,15:54,17:09,R CAMPINAS DO PIAUI, AMBOS, AV ITAQUERA
265,2023-02-15,1,Itaquera,Inativo Intransitável,15:56,15:59,AV ITAQUERA, CENTRO/BAIRRO, R BARRA DE GUABIRABA
266,2023-02-15,1,São Miguel Paulista,Inativo Intransitável,10:38,11:07,R ANTONIO DIAS DE MOURA, CENTRO/BAIRRO, ES DA BIACICA
267,2023-02-15,1,Santo Amaro,Inativo Intransitável,16:16,17:13,AV INTERLAGOS, AMBOS, R ENG ALLYRIO HUGUENEY DE MATTOS
268,2023-02-16,1,Casa Verde,Inativo Intransitável,21:17,23:30,AV ANTONIO MUNHOZ BONILHA, AMBOS, AV NSRA.DO O
269,2023-02-16,1,Casa Verde,Inativo Intransitável,21:22,23:00,R SUSANA DE GOIS, AMBOS, R CORREIA DE SA
270,2023-02-16,1,Casa Verde,Inativo Intransitável,21:34,23:30,R BARTHOLOMEU DO CANTO, UNICO, AV NSRA.DO O
271,2023-02-16,1,Sé,Inativo Transitável,21:29,23:00,MARGINAL TIETE, CASTELO B/A SENNA, PTE DAS BANDEIRAS SEN ROMEU TUMA
272,2023-02-16,1,Sé,Inativo Intransitável,21:29,23:00,AV PRES CASTELO BRANCO, CASTELO B/A SENNA, PTE DAS BANDEIRAS SEN ROMEU TUMA
273,2023-02-16,1,Sé,Inativo Transitável,22:10,22:30,R CAPISTRANO DE ABREU, UNICO, R CONSELHEIRO BROTERO
274,2023-02-16,1,Sé,Inativo Transitável,22:31,04:06,R PRES BATISTA PEREIRA, UNICO, R PRES COSTA PINTO
275,2023-02-16,1,Itaquera,Inativo Intransitável,21:27,23:00,AV ITAQUERA, AMBOS, R CAMPINAS DO PIAUI
276,2023-02-16,1,Mooca,Inativo Intransitável,21:21,23:30,AV ALCANTARA MACHADO, CENTRO/BAIRRO, R SILVA JARDIM
277,2023-02-16,1,Mooca,Inativo Intransitável,21:30,23:30,a 23:30R BRESSER, AMBOS, VD BRESSER-ROMUALDO HATTY
278,2023-02-16,1,Mooca,Inativo Intransitável,21:43,23:30,AV ALCANTARA MACHADO, AMBOS, VD GUADALAJARA-JOAO BEHISNELIAN
279,2023-02-16,1,Mooca,Inativo Intransitável,22:35,23:40,R ITAQUI, UNICO, R CARNOT
280,2023-02-16,1,Penha,Inativo Transitável,21:20,23:30,R DR LUIZ AYRES, CENTRO/BAIRRO, R MARIA EUGENIA CELSO
281,2023-02-16,1,Penha,Inativo Intransitável,22:31,23:36,R FRANCIS DE CASTELNAU, UNICO, R BERNARDO JOSE DE LORENA
282,2023-02-16,1,Vila Mariana,Inativo Transitável,21:03,23:00,AV STO AMARO, AMBOS, AV ROQUE PETRONI JUNIOR
283,2023-02-17,1,Santana,Inativo Intransitável,03:12,04:00,AV CRUZEIRO DO SUL, IPIRANGA/SANTANA, R PEDRO VICENTE
284,2023-02-17,1,Sé,Inativo Intransitável,06:42,09:16,R DOM RODO, AMBOS, R GUAPORE
285,2023-02-17,1,Sé,Inativo Transitável,07:30,07:37,R S PAULO (LIBERDADE), UNICO, R BR.DE IGUAPE
286,2023-02-17,1,São Mateus,Inativo Intransitável,05:27,09:16,AV JACU PESSEGO N TRABALHADORES, MAUA/A SENNA, AV RAGUEB CHOHFI
287,2023-02-18,1,Casa Verde,Inativo Intransitável,14:05,14:30,RUA ZILDA, AMBOS, AV. ENGENHEIRO CAETANO ÁLVARES
288,2023-02-18,1,Santana,Inativo Transitável,02:29,02:41,PC CAMPO DE BAGATELLE, AMBOS, R PROF MILTON RODRIGUES
289,2023-02-18,1,Santana,Inativo Intransitável,14:15,17:04,AC DIREITO A AV OTAVIANO ALVES (SANTANA), AMBOS, AV OTAVIANO ALVES DE LIMA
290,2023-02-18,1,Santana,Inativo Transitável,17:20,06:00,AV CRUZEIRO DO SUL, AMBOS, R GUAPORE
291,2023-02-18,1,Sé,Inativo Transitável,14:06,15:58,PC DA BANDEIRA, CENTRO/BAIRRO, PQ ANHANGABAU
292,2023-02-18,1,Sé,Inativo Intransitável,14:22,17:53,R MANOEL DUTRA, AMBOS, PC QUATORZE BIS
293,2023-02-18,1,Sé,Inativo Transitável,14:33,14:51,AV PRES CASTELO BRANCO, CASTELO B/A SENNA, R NEWTON PRADO
294,2023-02-18,1,Sé,Inativo Intransitável,17:16,06:44,R PORTO SEGURO, AMBOS, R PORTO CALVO
295,2023-02-18,1,Sé,Inativo Intransitável,17:18,06:44,R PORTO SEGURO, AMBOS, R DOM RODO
296,2023-02-18,1,Sé,Inativo Intransitável,17:35,06:00,R PAULINO GUIMARAES, UNICO, AV CRUZEIRO DO SUL
297,2023-02-18,1,Butantã,Inativo Intransitável,14:43,14:56,PC ELIS REGINA, AMBOS, R PEREIRA DO LAGO
298,2023-02-18,1,Butantã,Inativo Intransitável,15:49,20:26,AV LINEU DE PAULA MACHADO, AMBOS, AV LOPES DE AZEVEDO
299,2023-02-18,1,Butantã,Inativo Transitável,17:12,20:26,AV VITAL BRASIL, BAIRRO/CENTRO, AV PROF FRANCISCO MORATO
300,2023-02-18,1,Pinheiros,Inativo Intransitável,14:20,14:52,R HENRIQUE SCHAUMANN, SUMARE/IBIRAPUERA, AV REBOUCAS
301,2023-02-18,1,Pinheiros,Inativo Intransitável,14:41,22:59,R CARDEAL ARCOVERDE, AMBOS, R JOAO MOURA
302,2023-02-18,1,Pinheiros,Inativo Intransitável,14:54,15:14,:54 a 15:14PC APECATU, AMBOS, AV QUEIROZ FILHO
303,2023-02-18,1,Pinheiros,Inativo Transitável,17:44,22:47,R BRIG HAROLDO VELOSO, UNICO, AV CIDADE JARDIM
304,2023-02-18,1,Pinheiros,Inativo Transitável,18:13,19:34,R DOS PINHEIROS (PINHEIROS), AMBOS, R MATIAS VALADAO
305,2023-02-18,1,São Mateus,Inativo Intransitável,21:44,00:00,:00AV JACU PESSEGO N TRABALHADORES, MAUA/A SENNA, AV RAGUEB CHOHFI
306,2023-02-18,1,Vila Prudente,Inativo Intransitável,13:00,15:40,RUA LUCAS DE CAMARGO, AMBOS, RUA ARENITO
307,2023-02-18,1,Vila Prudente,Inativo Transitável,16:58,01:16,:58 a 01:16PC ALBERTO LION, SANTANA/IPIRANGA, VD DO RIO TAMANDUATEI
308,2023-02-18,1,Cidade Ademar,Inativo Intransitável,15:10,16:30,AV CUPECE, AMBOS, PQ NABUCO
309,2023-02-18,1,Santo Amaro,Inativo Intransitável,14:49,15:16,AV INTERLAGOS, AMBOS, R ENG DAGOBERTO SALLES FILHO
310,2023-02-18,1,Santo Amaro,Inativo Intransitável,14:49,14:35,AV DAS NAÇÕES UNIDAS, INTERLAGOS/CASTELO, PTE ENG ROBERTO ROSSI ZUCCOLO
311,2023-02-18,1,Santo Amaro,Inativo Intransitável,15:00,21:48,AV ROQUE PETRONI JUNIOR, AMBOS, AV PROF VICENTE RAO
312,2023-02-18,1,Santo Amaro,Inativo Transitável,17:13,22:22,:22AV ROQUE PETRONI JUNIOR, MARGINAL/DIADEMA, R CANCIONEIRO POPULAR
313,2023-02-18,1,Vila Mariana,Inativo Transitável,13:35,15:16,R ANTONIO DE QUEIROGA, AMBOS, R PEDRO DE TOLEDO
314,2023-02-18,1,Vila Mariana,Inativo Transitável,14:09,21:55,AV IBIRAPUERA, AMBOS, AV PEDRO ALVARES CABRAL
315,2023-02-18,1,Vila Mariana,Inativo Intransitável,14:24,15:16,AV VINTE E TRES DE MAIO, AEROPORTO/SANTANA, CV JOÃO JORGE SAAD
316,2023-02-19,1,Santana,Inativo Transitável,05:31,11:39,MARGINAL TIETE ASCB CENTRAL, A SENNA/CASTELO B, PTE CRUZEIRO DO SUL-JORN ARY SILVA
317,2023-02-19,1,Sé,Inativo Transitável,07:12,16:12,a 16:12R GAL OSORIO, BAIRRO/CENTRO, R DOS GUSMOES
318,2023-02-19,1,Sé,Inativo Transitável,08:42,16:11,AV MERCURIO, UNICO, R DA CANTAREIRA (BOM RETIRO)
319,2023-02-19,1,Sé,Inativo Transitável,08:56,15:56,a 15:56MARGINAL TIETE CBAS CENTRAL, CASTELO B/A SENNA, PTE GOV ORESTES QUERCIA
320,2023-02-19,1,Sé,Inativo Intransitável,09:06,15:56,MARGINAL TIETE CBAS EXPRESSA, CASTELO B/A SENNA, PTE DAS BANDEIRAS SEN ROMEU TUMA
321,2023-02-19,1,Sé,Inativo Transitável,10:45,15:34,R BR.DE JAGUARA, UNICO, R DA MOOCA
322,2023-02-19,1,São Mateus,Inativo Intransitável,07:40,14:00,AV JACU PESSEGO N TRABALHADORES, MAUA/A SENNA, R TOMOICHI SHIMIZU
323,2023-02-19,1,São Mateus,Inativo Intransitável,14:08,15:35,AV JACU PESSEGO N TRABALHADORES, MAUA/A SENNA, AV RAGUEB CHOHFI
324,2023-02-19,1,Vila Prudente,Inativo Transitável,06:48,16:10,AV DO ESTADO, SANTANA/IPIRANGA, R PAULA SOUSA
325,2023-02-19,1,Vila Prudente,Inativo Transitável,06:54,15:35,PC ALBERTO LION, SANTANA/IPIRANGA, VD DO RIO TAMANDUATEI
326,2023-02-19,1,Vila Prudente,Inativo Transitável,08:26,14:00,R JOAO TEODORO, SANTANA/IPIRANGA, AV DO ESTADO
327,2023-02-20,1,Vila Maria/ Vila Guilherme,Inativo Intransitável,17:44,18:30,R LUCAS DE FREITAS AZEVEDO, UNICO, AV LUIZ DUMONT VILLARES
328,2023-02-20,1,Santana,Inativo Intransitável,17:55,18:31,AV LUIZ DUMONT VILLARES, AMBOS, R TOME PORTES (TUCURUVI)
329,2023-02-20,1,Santana,Inativo Intransitável,17:55,18:30,PC ORLANDO SILVA, AMBOS, AV LUIZ DUMONT VILLARES
330,2023-02-20,1,Santana,Inativo Intransitável,18:07,22:18,:07 a 22:18AV ZAKI NARCHI, BAIRRO/CENTRO, AV CRUZEIRO DO SUL
331,2023-02-20,1,Santana,Inativo Intransitável,18:44,19:16,AV LUIZ DUMONT VILLARES, AMBOS, R VIRI
332,2023-02-20,1,Sé,Inativo Intransitável,18:12,18:30,PC DA BANDEIRA, CENTRO/BAIRRO, AV VINTE E TRES DE MAIO
333,2023-02-20,1,Sé,Inativo Intransitável,18:22,03:07,AV NOVE DE JULHO, BAIRRO/CENTRO, R HONDURAS (JD PAULISTA)
334,2023-02-20,1,Sé,Inativo Intransitável,18:54,18:55,AV PRES CASTELO BRANCO, CASTELO B/A SENNA, PTE DAS BANDEIRAS SEN ROMEU TUMA
335,2023-02-20,1,Lapa,Inativo Intransitável,17:56,18:53,AV ORDEM E PROGRESSO, AMBOS, R SAMARITA
336,2023-02-20,1,Itaquera,Inativo Intransitável,17:10,17:42,AV ITAQUERA, AMBOS, R BARRA DE GUABIRABA
337,2023-02-20,1,Vila Mariana,Inativo Transitável,18:19,18:30,AV VINTE E TRES DE MAIO, AEROPORTO/SANTANA, VD GAL EUCLIDES DE FIGUEIREDO
338,2023-02-21,1,Sé,Inativo Transitável,01:57,02:35,MARGINAL TIETE CBAS EXPRESSA, CASTELO B/A SENNA, PTE DO LIMAO-ADHEMAR F. DA SILVA
339,2023-02-21,1,Sé,Inativo Intransitável,19:01,19:48,R MANOEL DUTRA, CENTRO/BAIRRO, PC QUATORZE BIS
340,2023-02-21,1,Lapa,Inativo Intransitável,18:30,18:49,AV POMPEIA, POMPEIA/MARGINAL, R PALESTRA ITALIA
341,2023-02-21,1,Lapa,Inativo Intransitável,18:36,18:49,AV POMPEIA, POMPEIA/MARGINAL, R PALESTRA ITALIA
342,2023-02-21,1,Itaquera,Inativo Transitável,16:12,17:15,AV ITAQUERA, BAIRRO/CENTRO, R CAMPINAS DO PIAUI
343,2023-02-21,1,Mooca,Inativo Intransitável,23:20,07:22,AV CELSO GARCIA, CENTRO/BAIRRO, R JOSE DE ALENCAR (BRAS)
344,2023-02-21,1,Penha,Inativo Intransitável,22:05,22:27,R DR LUIZ AYRES, BAIRRO/CENTRO, R MACIEL MONTEIRO
345,2023-02-21,1,Penha,Inativo Intransitável,22:08,22:28,R TRES (V MAT), BAIRRO/CENTRO, R JOAQUIM MARRA
346,2023-02-21,1,M'Boi Mirim,Inativo Transitável,19:46,20:12,ES GUAVIRITUBA, AMBOS, ES DA RIVIERA
347,2023-02-21,1,Santo Amaro,Inativo Intransitável,18:53,19:53,a 19:53AV DAS NACOES UNIDAS, INTERLAGOS/CASTELO, R OLIVIA FEDER
348,2023-02-21,1,Santo Amaro,Inativo Intransitável,19:10,20:12,AV ROQUE PETRONI JUNIOR, MARGINAL/DIADEMA, R CANCIONEIRO POPULAR
349,2023-02-21,1,Santo Amaro,Inativo Intransitável,19:11,20:09,AV DAS NACOES UNIDAS, CASTELO/INTERLAGOS, R JAIME DE OLIVEIRA SOUZA
350,2023-02-21,1,Santo Amaro,Inativo Transitável,19:15,20:12,AV STO AMARO, AMBOS, R DOS BRASOES
351,2023-02-21,1,Santo Amaro,Inativo Intransitável,19:18,19:25,MARGINAL PINHEIROS INTCB, INTERLAGOS/CASTELO, PTE EUSEBIO MATOSO
352,2023-02-22,1,Lapa,Inativo Transitável,14:51,16:00,R PALESTRA ITALIA, UNICO, AV POMPEIA
353,2023-02-22,1,São Mateus,Inativo Intransitável,08:46,10:23,AV JACU PESSEGO N TRABALHADORES, MAUA/A SENNA, AV RAGUEB CHOHFI
354,2023-02-23,1,Casa Verde,Inativo Transitável,16:30,17:45,R MATEUS MASCARENHAS, UNICO, R CEL MARIO DE AZEVEDO
355,2023-02-23,1,Vila Maria/ Vila Guilherme,Inativo Intransitável,16:04,18:04,a 18:04AV SANATORIO, AMBOS, AV EDU CHAVES
356,2023-02-23,1,Lapa,Inativo Transitável,15:20,20:43,AV ENG BILLINGS, CASTELO/INTERLAGOS, PC ALBERTO RANGEL
357,2023-02-23,1,Lapa,Inativo Intransitável,16:25,21:51,R VLADIMIR HERZOG, AMBOS, R CARLOS SPERA
358,2023-02-23,1,Lapa,Inativo Transitável,17:28,20:43,MARGINAL TIETE CBAS EXPRESSA, CB/AS - EXP, CEBOLAO
359,2023-02-23,1,Pinheiros,Inativo Intransitável,17:43,18:50,R BRIG HAROLDO VELOSO, UNICO, AV CIDADE JARDIM
360,2023-02-23,1,Cidade Tiradentes,Inativo Intransitável,16:10,17:25,R INÁCIO MONTEIRO, AMBOS, R FRANÇA DE OLIVEIRA
361,2023-02-23,1,Itaquera,Inativo Transitável,16:50,18:45,ES ITAQUERA GUAIANASES, AMBOS, R SALVADOR GIANETTI
362,2023-02-23,1,Itaquera,Inativo Intransitável,17:31,18:45,R TAPURAÍBA, AMBOS, R GUITICOROIA
363,2023-02-23,1,Itaim Paulista,Inativo Transitável,15:00,16:30,R ITAJUIBE, AMBOS, R VASCO PIRES DA MOTA
364,2023-02-23,1,São Miguel Paulista,Inativo Intransitável,16:00,18:45,AV COROA DE FRADE, AMBOS, R LEOPOLDO DELISLE
365,2023-02-23,1,São Mateus,Inativo Intransitável,17:59,00:44,AV JACU PESSEGO N TRABALHADORES, A SENNA/MAUA, AV RAGUEB CHOHFI
366,2023-02-23,1,Santo Amaro,Inativo Intransitável,14:11,14:48,AV INTERLAGOS, AMBOS, R ENG DAGOBERTO SALLES FILHO
367,2023-02-23,1,Santo Amaro,Inativo Intransitável,14:14,17:10,AV VITOR MANZINI, CENTRO/BAIRRO, R ELIAS ANTONIO ZOGBI
368,2023-02-23,1,Santo Amaro,Inativo Transitável,14:23,17:17,:17R ANA MARGARIDA DAS DORES, BAIRRO/CENTRO, R CD LUIZ ZUNTA
369,2023-02-23,1,Santo Amaro,Inativo Intransitável,14:38,17:10,AV ROQUE PETRONI JUNIOR, MARGINAL/DIADEMA, R CANCIONEIRO POPULAR
370,2023-02-23,1,Santo Amaro,Inativo Intransitável,14:38,17:09,AV ROQUE PETRONI JUNIOR, AMBOS, LG LOS ANDES
371,2023-02-23,1,Santo Amaro,Inativo Transitável,14:42,15:23,AV SARG LOURIVAL ALVES DE SOUZA, AMBOS, R SARG MANUEL BARBOSA DA SILVA
372,2023-02-23,1,Santo Amaro,Inativo Intransitável,15:17,18:43,AV DAS NACOES UNIDAS, INTERLAGOS/CASTELO, R OLIVIA FEDER
373,2023-02-23,1,Santo Amaro,Inativo Intransitável,15:30,17:20,AV VER JOÃO DE LUCA, AMBOS, AV WASHINGTON LUIZ
374,2023-02-23,1,Santo Amaro,Inativo Intransitável,15:32,16:49,AV JORN ROBERTO MARINHO, AEROPORTO/MARGINAL, AV ENG LUIZ CARLOS BERRINI
375,2023-02-23,1,Santo Amaro,Inativo Transitável,15:45,18:44,MARGINAL PINHEIROS INTCB, INTERLAGOS/CASTELO, PTE ENG ARY TORRES
376,2023-02-23,1,Vila Mariana,Inativo Intransitável,14:02,14:09,R DR HABERBECK BRANDAO, UNICO, AV ONZE DE JUNHO
377,2023-02-23,1,Vila Mariana,Inativo Transitável,14:08,14:24,AV IBIRAPUERA, BAIRRO/CENTRO, AV JANDIRA
378,2023-02-23,1,Vila Mariana,Inativo Intransitável,14:29,16:46,AV STO AMARO, CENTRO/BAIRRO, AV ROQUE PETRONI JUNIOR
379,2023-02-24,1,Sé,Inativo Transitável,12:41,12:56,R HERCULES FLORENCE, BAIRRO/CENTRO, R FERNAO SALES
380,2023-02-24,1,Pinheiros,Inativo Transitável,19:29,20:40,R ESTADOS UNIDOS, CENTRO/BAIRRO, R BELA CINTRA
381,2023-02-24,1,São Mateus,Inativo Intransitável,05:21,09:54,AV JACU PESSEGO N TRABALHADORES, A SENNA/MAUA, AV RAGUEB CHOHFI
382,2023-02-28,1,Lapa,Inativo Intransitável,16:34,18:22,R VLADIMIR HERZOG, AMBOS, R CARLOS SPERA
383,2023-02-28,1,Ermelino Matarazzo,Inativo Intransitável,15:58,16:29,R ASDRUBAL, UNICO, R JOAO JOSE RODRIGUES
384,2023-02-28,1,Itaquera,Inativo Intransitável,14:15,14:34,AV ITAQUERA, AMBOS, R CAMPINAS DO PIAUI
385,2023-02-28,1,Itaquera,Inativo Intransitável,16:30,19:00,AV LIDER, AMBOS, AV ITAQUERA
386,2023-02-28,1,São Miguel Paulista,Inativo Intransitável,15:21,16:19,R ENG JOSE CRUZ DE OLIVEIRA, AMBOS, R ADRUBAL
387,2023-03-03,1,Sé,Inativo Intransitável,17:55,19:08,R PRES BATISTA PEREIRA, UNICO, R PRES COSTA PINTO
388,2023-03-03,1,Cidade Ademar,Inativo Intransitável,17:00,19:00,a 19:00AV SENADOR TEOTONIO VILELA, AMBOS, AV RODRIGUES VILARES
389,2023-03-03,1,Campo Limpo,Inativo Intransitável,19:19,19:45,R MARIA BLANCHARD, CENTRO/BAIRRO, AV COMEN SANT'ANNA
390,2023-03-08,1,Sé,Inativo Intransitável,17:23,17:56,R MANOEL DUTRA, AMBOS, PC QUATORZE BIS
391,2023-03-08,1,Sé,Inativo Transitável,17:33,19:06,AV RANGEL PESTANA, CENTRO/BAIRRO, R HIPODROMO
392,2023-03-08,1,Butantã,Inativo Intransitável,18:34,04:47,MARGINAL PINHEIROS, CASTELO/INTERLAGOS, AV ALCIDES SANGIRARDI
393,2023-03-08,1,Butantã,Inativo Intransitável,18:41,20:11,MARGINAL PINHEIROS CBINT, CASTELO/INTERLAGOS, AV ALCIDES SANGIRARDI
394,2023-03-08,1,Pinheiros,Inativo Transitável,16:34,19:23,AV FARIA LIMA, AMBOS, R LEOPOLDO COUTO DE MAGALHAES JUNIOR
395,2023-03-08,1,Pinheiros,Inativo Transitável,17:22,18:50,AV CIDADE JARDIM, AMBOS, AV NOVE DE JULHO
396,2023-03-08,1,Pinheiros,Inativo Intransitável,17:24,19:50,AV NOVE DE JULHO, BAIRRO/CENTRO, AV CIDADE JARDIM
397,2023-03-08,1,Pinheiros,Inativo Transitável,17:31,18:20,AV BRASIL, IBIRAPUERA/PINHEIROS, AV NOVE DE JULHO
398,2023-03-08,1,Pinheiros,Inativo Intransitável,18:03,19:50,TN MAX FEFFER, BAIRRO/CENTRO, AV CIDADE JARDIM
399,2023-03-08,1,Itaquera,Inativo Intransitável,17:00,20:30,R CAROLINA FONSECA, AMBOS, R PIRES DO RIO
400,2023-03-08,1,Itaquera,Inativo Intransitável,17:00,20:30,AV DR FRANCISCO MUNHOZ FILHO, AMBOS, RUA JOSÉ GIL
401,2023-03-08,1,Itaquera,Inativo Intransitável,17:00,20:30,R FLOR DA ESPERANÇA, AMBOS, R FLOR DE BADABO
402,2023-03-08,1,Itaquera,Inativo Intransitável,17:00,20:30,AV JOSÉ PINHEIRO BORGES, AMBOS, AV JACU PESSEGO
403,2023-03-08,1,Itaquera,Inativo Intransitável,17:05,20:30,AV PADRE VIEGAS DE MENEZES, AMBOS, AV CAMPANELLA
404,2023-03-08,1,Itaquera,Inativo Intransitável,17:21,18:48,R PDE VIEGAS DE MENEZES, AMBOS, AV CAMPANELLA
405,2023-03-08,1,Itaquera,Inativo Intransitável,17:25,18:48,AV ITAQUERA, AMBOS, R BARRA DE GUABIRABA
406,2023-03-08,1,Mooca,Inativo Transitável,17:55,19:06,R JOSE DE ALENCAR (BRAS), UNICO, R DR JOAO ALVES DE LIMA
407,2023-03-08,1,São Miguel Paulista,Inativo Intransitável,17:06,18:50,R ASDRUBAL, UNICO, R ENG JOSE CRUZ DE OLIVEIRA
408,2023-03-08,1,São Miguel Paulista,Inativo Intransitável,17:16,18:45,R AMERICO SUGAI, CENTRO/BAIRRO, AV JACU PESSEGO N TRABALHADORES
409,2023-03-08,1,São Miguel Paulista,Inativo Transitável,17:50,19:06,AV MAL TITO, CENTRO/BAIRRO, R GENDIROBA
410,2023-03-08,1,São Miguel Paulista,Inativo Intransitável,18:14,18:30,R AMERICO SUGAI, AMBOS, AV JACU PESSEGO N TRABALHADORES
411,2023-03-08,1,Penha,Inativo Intransitável,17:18,17:53,AV S MIGUEL, AMBOS, AV DOM HELDER CAMARA
412,2023-03-08,1,Penha,Inativo Intransitável,17:52,19:06,AV CELSO GARCIA, CENTRO/BAIRRO, R JOSE DE ALENCAR (BRAS)
413,2023-03-08,1,São Mateus,Inativo Intransitável,18:37,20:53,AV ARICANDUVA, MARGINAL/ITAQUERA, AV ITAQUERA
414,2023-03-08,1,Vila Prudente,Inativo Intransitável,17:10,19:19,:19AV PROF LUIZ IGNACIO ANHAIA MELLO, SAPOPEMBA/V PRUDENTE, R MANOEL CUADRADO MARTIN
415,2023-03-08,1,Capela do Socorro,Inativo Intransitável,17:41,19:13,AV JOAO DE BARROS, CENTRO/BAIRRO, AV ATLANTICA
416,2023-03-08,1,M'Boi Mirim,Inativo Transitável,18:11,20:16,R AGAMENON PEREIRA DA SILVA, BAIRRO/CENTRO, R MANUEL DA COSTA DANTAS
417,2023-03-08,1,Santo Amaro,Inativo Transitável,17:19,04:47,MARGINAL PINHEIROS, INTERLAGOS/CASTELO, PTE EUSEBIO MATOSO
418,2023-03-08,1,Santo Amaro,Inativo Transitável,17:32,20:07,R CENTRO AFRICANA, CENTRO/BAIRRO, AV JOÃO DIAS
419,2023-03-08,1,Santo Amaro,Inativo Intransitável,17:36,18:51,AV DAS NACOES UNIDAS, INTERLAGOS/CASTELO, PTE ENG ROBERTO ROSSI ZUCCOLO
420,2023-03-08,1,Santo Amaro,Inativo Intransitável,17:55,18:19,AV INTERLAGOS, CENTRO/BAIRRO, R ENG ALLYRIO HUGUENEY DE MATTOS
421,2023-03-08,1,Santo Amaro,Inativo Intransitável,18:05,19:37,AV DAS NACOES UNIDAS, INTERLAGOS/CASTELO, PTE ENG ROBERTO ROSSI ZUCCOLO
422,2023-03-08,1,Santo Amaro,Inativo Transitável,19:57,04:47,AV JOAO DORIA, INTERLAGOS/CASTELO, MARGINAL PINHEIROS INTCB
423,2023-03-08,1,Vila Mariana,Inativo Transitável,17:06,18:47,AV DOS BANDEIRANTES, MARGINAL/IMIGRANTES, VD STO AMARO
424,2023-03-08,1,Vila Mariana,Inativo Transitável,17:16,18:48,AV DOS BANDEIRANTES, MARGINAL/IMIGRANTES, R CD.DE PORTO ALEGRE
425,2023-03-08,1,Vila Mariana,Inativo Transitável,17:25,04:47,R CLAES BERCHEM, MARGINAL/IMIGRANTES, R INHAMBU
426,2023-03-08,1,Vila Mariana,Inativo Intransitável,17:32,19:03,AV VINTE E TRES DE MAIO, AEROPORTO/SANTANA, VD GAL EUCLIDES DE FIGUEIREDO
427,2023-03-08,1,Vila Mariana,Inativo Transitável,17:32,19:54,AV DOS BANDEIRANTES, MARGINAL/IMIGRANTES, AV WASHINGTON LUIS
428,2023-03-08,1,Vila Mariana,Inativo Intransitável,17:45,18:52,CV AYRTON SENNA, IBIRAPUERA/MARGINAL, CV TRIBUNAL DE JUSTICA DO E. SP
429,2023-03-09,1,Vila Maria/ Vila Guilherme,Inativo Intransitável,15:07,15:14,AV GUILHERME, AMBOS, ESC ESCADARIA
430,2023-03-09,1,Sé,Inativo Transitável,14:34,15:30,MARGINAL TIETE CBAS CENTRAL, CASTELO B/A SENNA, PTE DA CASA VERDE-JORN.WALTER ABRAHAO
431,2023-03-09,1,Sé,Inativo Intransitável,15:04,15:29,R PRES BATISTA PEREIRA, NAO INFORMADO, R PRES COSTA PINTO
432,2023-03-09,1,Sé,Inativo Transitável,15:36,17:51,MARGINAL TIETE CBAS CENTRAL, CASTELO B/A SENNA, PTE CRUZEIRO DO SUL-JORN ARY SILVA
433,2023-03-09,1,Sé,Inativo Transitável,18:15,19:50,R PEDRO VICENTE, UNICO, R EDMUNDO VELLOSO
434,2023-03-09,1,Butantã,Inativo Intransitável,14:54,17:10,AV MAGALHAES DE CASTRO, CASTELO/INTERLAGOS, PTE ENG ARY TORRES
435,2023-03-09,1,Lapa,Inativo Intransitável,14:38,16:28,AV ORDEM E PROGRESSO, SUMARE/LIMAO, R SAMARITA
436,2023-03-09,1,Lapa,Inativo Transitável,14:47,16:32,PC PASCOAL MARTINS, NAO INFORMADO, AV MARQ.DE SAO VICENTE
437,2023-03-09,1,Pinheiros,Inativo Transitável,14:39,14:51,R HENRIQUE SCHAUMANN, AMBOS, AV REBOUCAS
438,2023-03-09,1,Aricanduva/ Vila Formosa,Inativo Intransitável,14:49,16:52,R PEDRO MALAQUIAS, CENTRO/BAIRRO, AV DEZENOVE DE JANEIRO
439,2023-03-09,1,Mooca,Inativo Intransitável,14:45,15:28,AV ALCANTARA MACHADO, CENTRO/BAIRRO, VD GUADALAJARA-JOAO BEHISNELIAN
440,2023-03-09,1,Mooca,Inativo Intransitável,14:45,15:28,AV ALCANTARA MACHADO, AMBOS, VD GUADALAJARA-JOAO BEHISNELIAN
441,2023-03-09,1,Mooca,Inativo Intransitável,15:30,16:25,AV ABEL FERREIRA, AMBOS, PC ARMANDO CARDARELLI
442,2023-03-09,1,Sapopemba,Inativo Intransitável,15:30,16:20,TRAVESSA HILARION QUINTANA, AMBOS, JULIPEIRA
443,2023-03-09,1,Vila Prudente,Inativo Intransitável,14:48,16:10,AV PROF LUIZ IGNACIO DE ANHAIA MELLO, AMBOS, AV SALIM FARAH MALUF
444,2023-03-09,1,Vila Prudente,Inativo Intransitável,14:59,19:06,AV FRANCISCO FALCONI, UNICO, R ARACATI-MIRIM
445,2023-03-09,1,Vila Prudente,Inativo Intransitável,15:06,19:06,a 19:06AV JACINTO MENEZES PALHARES, AMBOS, AV PROF LUIZ IGNACIO ANHAIA MELLO
446,2023-03-10,1,Freguesia do Ó,Inativo Intransitável,15:32,16:10,R MATEUS MASCARENHAS, AMBOS, CEL. MARIO DE AZEVEDO
447,2023-03-10,1,Vila Maria/ Vila Guilherme,Inativo Transitável,14:45,15:48,AV SANATORIO, AMBOS, AV EDU CHAVES
448,2023-03-10,1,Vila Maria/ Vila Guilherme,Inativo Intransitável,14:51,17:04,R CHICO PONTES, CENTRO/BAIRRO, AV GUILHERME
449,2023-03-10,1,Vila Maria/ Vila Guilherme,Inativo Intransitável,15:01,15:48,AV SANATORIO, AMBOS, R FRANCISCO ALVES BEZERRA
450,2023-03-10,1,Santana,Inativo Intransitável,15:00,16:48,AV DO ESTADO, AEROPORTO/SANTANA, R GUAPORE
451,2023-03-10,1,Santana,Inativo Transitável,15:34,15:43,MARGINAL TIETE EXPRESSA, A SENNA/CASTELO B, PTE CRUZEIRO DO SUL
452,2023-03-10,1,Santana,Inativo Transitável,15:39,15:49,MARGINAL TIETE EXPRESSA, A SENNA/CASTELO B, PTE CRUZEIRO DO SUL
453,2023-03-10,1,Sé,Inativo Intransitável,13:14,13:28,R MANOEL DUTRA, UNICO, PC QUATORZE BIS
454,2023-03-10,1,Sé,Inativo Intransitável,14:41,15:43,PC QUATORZE BIS, AMBOS, R MANOEL DUTRA
455,2023-03-10,1,Sé,Inativo Intransitável,14:46,15:41,R MANOEL DUTRA, UNICO, PC QUATORZE BIS
