,Data,Alagamento,Bairro,Tipo,Horário Inicial,Horário Final,Endereço,Sentido,Referência
456,2023-03-10,1,Sé,Inativo Intransitável,14:50,15:48,AV RANGEL PESTANA, AMBOS, R HIPODROMO
457,2023-03-10,1,Sé,Inativo Transitável,14:50,15:36,AV PRES CASTELO BRANCO, CASTELO B/A SENNA, PTE DO LIMAO-ADHEMAR F. DA SILVA
458,2023-03-10,1,Sé,Inativo Transitável,14:52,15:36,AV PRES CASTELO BRANCO, CASTELO B/A SENNA, AC A PONTE DA CASA VERDE
459,2023-03-10,1,Sé,Inativo Intransitável,14:59,15:44,AV PRES CASTELO BRANCO, CASTELO B/A SENNA, PTE DAS BANDEIRAS SEN ROMEU TUMA
460,2023-03-10,1,Sé,Inativo Transitável,15:21,16:28,PC PASCOAL MARTINS, LAPA/B FUNDA, AC A AV MARQUES DE SAO VICENTE
461,2023-03-10,1,Sé,Inativo Intransitável,15:24,16:13,R S PAULO, UNICO, R TEIXEIRA LEITE
462,2023-03-10,1,Sé,Inativo Intransitável,15:45,16:26,PC PASCOAL MARTINS, LAPA/B FUNDA, AC A AV MARQUES DE SAO VICENTE
463,2023-03-10,1,Sé,Inativo Transitável,15:54,17:02,R CARLOS GARCIA, UNICO, R STA ROSA
464,2023-03-10,1,Sé,Inativo Transitável,15:59,16:00,AV PRES CASTELO BRANCO, CASTELO B/A SENNA, PTE DAS BANDEIRAS SEN ROMEU TUMA
465,2023-03-10,1,Sé,Inativo Transitável,16:00,16:48,R DA CANTAREIRA, AMBOS, AV MERCURIO
466,2023-03-10,1,Sé,Inativo Intransitável,16:01,16:47,MARGINAL TIETE CENTRAL, CASTELO B/A SENNA, PTE DAS BANDEIRAS SEN ROMEU TUMA
467,2023-03-10,1,Sé,Inativo Transitável,16:06,17:05,VEL PRES JOAO GOULART, AMBOS, AV PACAEMBU
468,2023-03-10,1,Butantã,Inativo Intransitável,14:58,15:36,AV PROF FRANCISCO MORATO, BAIRRO/CENTRO, AV PROF GIOIA MARTINS
469,2023-03-10,1,Butantã,Inativo Intransitável,15:08,15:36,AV PROF FRANCISCO MORATO, AMBOS, AV PROF GIOIA MARTINS
470,2023-03-10,1,Butantã,Inativo Intransitável,15:16,15:35,AV PROF FRANCISCO MORATO, BAIRRO/CENTRO, PC PAULA MOREIRA
471,2023-03-10,1,Butantã,Inativo Intransitável,16:57,17:06,AV PROF FRANCISCO MORATO, BAIRRO/CENTRO, PC PAULA MOREIRA
472,2023-03-10,1,Lapa,Inativo Intransitável,14:46,16:48,AV ORDEM E PROGRESSO, AMBOS, R SAMARITA
473,2023-03-10,1,Lapa,Inativo Transitável,14:57,15:30,PC PASCOAL MARTINS, BAIRRO/CENTRO, AV MARQ.DE SAO VICENTE
474,2023-03-10,1,Lapa,Inativo Intransitável,15:48,15:49,AV ORDEM E PROGRESSO, AMBOS, PC DEL AMOROSO NETO
475,2023-03-10,1,Pinheiros,Inativo Intransitável,14:46,15:41,R JOAO MOURA, UNICO, R ABEGOARIA
476,2023-03-10,1,Pinheiros,Inativo Intransitável,15:04,15:20,R HENRIQUE SCHAUMANN, IBIRAPUERA/SUMARE, AV REBOUCAS
477,2023-03-10,1,Pinheiros,Inativo Intransitável,15:22,16:48,AV DRA RUTH CARDOSO, INTERLAGOS/CASTELO, AV ENG ROBERTO ZUCCOLO
478,2023-03-10,1,Aricanduva/ Vila Formosa,Inativo Transitável,14:00,15:51,R CARLOS SILVA, AMBOS, R ACANGATARA
479,2023-03-10,1,Itaquera,Inativo Intransitável,14:14,15:47,AV ITAQUERA, AMBOS, R CAMPINAS DO PIAUI
480,2023-03-10,1,Itaquera,Inativo Intransitável,16:46,17:30,AV LIDER, AMBOS, HARRY DANNENBERG
481,2023-03-10,1,Mooca,Inativo Transitável,15:04,15:48,R HIPODROMO, UNICO, AV RANGEL PESTANA
482,2023-03-10,1,Mooca,Inativo Intransitável,15:10,15:50,VD BRESSER, SENTIDO MOOCA, R JOAO CAETANO
483,2023-03-10,1,Mooca,Inativo Intransitável,15:32,15:48,R GUARAPUAVA, AMBOS, ALTURA DO NUMERO 172
484,2023-03-10,1,Mooca,Inativo Transitável,18:30,01:23,R DR JOAO ALVES DE LIMA, CENTRO/BAIRRO, R HIPODROMO
485,2023-03-10,1,Penha,Inativo Intransitável,18:26,01:22,AV CELSO GARCIA, CENTRO/BAIRRO, R JOSE DE ALENCAR (BRAS)
486,2023-03-10,1,Vila Prudente,Inativo Transitável,15:07,17:19,AV PROF LUIZ IGNACIO ANHAIA MELLO, SAPOPEMBA/V PRUDENTE, PA ANTONIO FABIANO
487,2023-03-10,1,Vila Prudente,Inativo Intransitável,15:13,17:05,AV DO ESTADO, IPIRANGA/SANTANA, R S CAETANO
488,2023-03-10,1,Parelheiros,Inativo Intransitável,15:10,17:07,ES ECOTURISTICA DE PARELHEIROS, AMBOS, R JOSE ROSCHEL RODRIGUES
489,2023-03-10,1,Santo Amaro,Inativo Intransitável,13:41,16:49,AV DAS NACOES UNIDAS, INTERLAGOS/CASTELO, AV MARIO LOPES LEAO
490,2023-03-10,1,Santo Amaro,Inativo Transitável,13:42,15:50,AV INTERLAGOS, CENTRO/BAIRRO, AV YERVANT KISSAJIKIAN
491,2023-03-10,1,Santo Amaro,Inativo Intransitável,13:47,15:50,R PROF ANISIO GONCALVES MARECO, BAIRRO/CENTRO, R ENG DOMICIO DE L. PACHECO E SILVA
492,2023-03-10,1,Santo Amaro,Inativo Intransitável,13:55,16:49,AV DAS NACOES UNIDAS, INTERLAGOS/CASTELO, R JAIME DE OLIVEIRA SOUZA
493,2023-03-10,1,Santo Amaro,Inativo Intransitável,14:07,17:23,AV ROQUE PETRONI JUNIOR, MARGINAL/DIADEMA, R CANCIONEIRO POPULAR
494,2023-03-10,1,Santo Amaro,Inativo Intransitável,14:33,14:53,R ELIAS ANTONIO ZOGBI, AMBOS, AV VITOR MANZINI
495,2023-03-10,1,Santo Amaro,Inativo Intransitável,14:47,16:22,AV VITOR MANZINI, AMBOS, R ELIAS ANTONIO ZOGBI
496,2023-03-10,1,Santo Amaro,Inativo Intransitável,15:29,16:47,AV DAS NACOES UNIDAS, INTERLAGOS/CASTELO, PTE ENG ROBERTO ROSSI ZUCCOLO
497,2023-03-10,1,Santo Amaro,Inativo Intransitável,15:42,16:27,AV DAS NACOES UNIDAS, INTERLAGOS/CASTELO, R OLIVIA FEDER
498,2023-03-10,1,Santo Amaro,Inativo Transitável,15:45,16:27,AV DAS NACOES UNIDAS, INTERLAGOS/CASTELO, R OLIVIA FEDER
499,2023-03-10,1,Vila Mariana,Inativo Transitável,15:22,15:54,AV VINTE E TRES DE MAIO, SANTANA/AEROPORTO, PC DA BANDEIRA
500,2023-03-11,1,Butantã,Inativo Intransitável,17:30,18:24,AV PROF FRANCISCO MORATO, BAIRRO/CENTRO, PC PAULA MOREIRA
501,2023-03-11,1,Butantã,Inativo Intransitável,17:32,20:00,AV PROF FRANCISCO MORATO, BAIRRO/CENTRO, AV PROF GIOIA MARTINS
502,2023-03-11,1,Butantã,Inativo Intransitável,17:36,18:28,AV DEP JACOB SALVADOR ZVEIBIL, ELISEU/MORATO, AV PROF FRANCISCO MORATO
503,2023-03-11,1,Pinheiros,Inativo Intransitável,18:27,18:53,R BRIG HAROLDO VELOSO, UNICO, AV CIDADE JARDIM
504,2023-03-11,1,Sapopemba,Inativo Intransitável,16:27,18:50,TRAVESSA HILARION QUINTANA, AMBOS, RUA JULIPEIRA
505,2023-03-11,1,Vila Prudente,Inativo Intransitável,16:16,18:50,AV PROF LUIZ IGNACIO DE ANHAIA MELLO, AMBOS, AV SALIM FARAH MALUF
506,2023-03-11,1,Vila Prudente,Inativo Intransitável,16:22,17:41,CV SEN ANTONIO E. DE BARROS FILHO, V PRUDENTE/MARGINAL, AV PROF LUIZ IGNACIO ANHAIA MELLO
507,2023-03-11,1,Vila Prudente,Inativo Intransitável,17:01,17:41,AV PROF LUIZ IGNACIO ANHAIA MELLO, AMBOS, R AMERICO VESPUCCI
508,2023-03-12,1,Vila Maria/ Vila Guilherme,Inativo Intransitável,17:03,18:23,AV BANDEIRANTES DO SUL, BAIRRO/CENTRO, R ARENAL
509,2023-03-12,1,Pinheiros,Inativo Transitável,17:33,02:36,AV BRIG FARIA LIMA, ITAIM/PINHEIROS, R TEODORO SAMPAIO
510,2023-03-12,1,Itaquera,Inativo Intransitável,14:11,14:32,AV ITAQUERA, AMBOS, R CASTELO DO PIAUI
511,2023-03-12,1,Penha,Inativo Intransitável,15:49,15:54,AV GOV CARVALHO PINTO, BAIRRO/CENTRO, AV TARUMA
512,2023-03-13,1,Vila Maria/ Vila Guilherme,Inativo Transitável,16:02,17:42,AV GUILHERME, UNICO, ESC ESCADARIA
513,2023-03-13,1,Santana,Inativo Intransitável,15:23,17:01,R PROF MILTON RODRIGUES, SANTANA/C VERDE, PC CAMPO DE BAGATELLE
514,2023-03-13,1,Santana,Inativo Transitável,15:50,17:36,R CEL ANTONIO DE CARVALHO, UNICO, R URUPIARA
515,2023-03-13,1,Santana,Inativo Transitável,15:50,17:36,R CEL ANTONIO DE CARVALHO, UNICO, R URUPIARA
516,2023-03-13,1,Santana,Inativo Intransitável,15:57,16:30,AV CRUZEIRO DO SUL, AMBOS, METRO POTUGUESA TIETE
517,2023-03-13,1,Santana,Inativo Intransitável,15:58,16:59,AV DO ESTADO, AEROPORTO/SANTANA, R GUAPORE
518,2023-03-13,1,Santana,Inativo Intransitável,17:17,18:21,AV SANTOS DUMONT, AEROPORTO/SANTANA, AV DO ESTADO
519,2023-03-13,1,Sé,Inativo Transitável,15:19,17:33,PC FERNANDO COSTA, UNICO, R S NICOLAU (SE)
520,2023-03-13,1,Sé,Inativo Transitável,15:25,15:36,AV PACAEMBU, AMBOS, AC A VEL PRES ARTHUR DA C E SILVA (SANTA CECILIA)
521,2023-03-13,1,Sé,Inativo Intransitável,16:25,01:53,AV MERCURIO, UNICO, PC S VITO
522,2023-03-13,1,Sé,Inativo Intransitável,16:30,16:48,MARGINAL TIETE CBAS CENTRAL, CASTELO B/A SENNA, AV PRES CASTELO BRANCO
523,2023-03-13,1,Sé,Inativo Transitável,16:45,17:26,R DJALMA DUTRA, UNICO, R VINTE E CINCO DE JANEIRO (BOM RETIRO)
524,2023-03-13,1,Sé,Inativo Intransitável,16:46,16:56,MARGINAL TIETE CBAS CENTRAL, CASTELO B/A SENNA, PTE DAS BANDEIRAS SEN ROMEU TUMA
525,2023-03-13,1,Sé,Inativo Transitável,18:58,21:06,R OSCAR HORTA, UNICO, R CEL CINTRA
526,2023-03-13,1,Butantã,Inativo Intransitável,16:05,17:33,AV MAGALHAES DE CASTRO, CASTELO/INTERLAGOS, R PEDRO AVANCINE
527,2023-03-13,1,Butantã,Inativo Intransitável,16:53,18:56,PC ALFREDO GOMES, UNICO, R FLORIANO PEIXOTO SANTOS
528,2023-03-13,1,Butantã,Inativo Intransitável,16:54,18:56,PC ALFREDO GOMES, UNICO, AV JULES RIMET
529,2023-03-13,1,Lapa,Inativo Transitável,17:48,18:42,R FEDERACAO PAULISTA DE FUTEBOL, UNICO, AV ANTARTICA
530,2023-03-13,1,Pinheiros,Inativo Transitável,09:14,10:07,R JAPIACOIA, CENTRO/BAIRRO, AV DIOGENES RIBEIRO DE LIMA
531,2023-03-13,1,Pinheiros,Inativo Transitável,15:36,16:27,R HENRIQUE SCHAUMANN, IBIRAPUERA/SUMARE, AV REBOUCAS
532,2023-03-13,1,Pinheiros,Inativo Intransitável,16:50,19:03,R BRIG HAROLDO VELOSO, BAIRRO/CENTRO, AV CIDADE JARDIM
533,2023-03-13,1,Aricanduva/ Vila Formosa,Inativo Intransitável,15:58,16:30,AV MONTEMAGNO, UNICO, R JORGE BITTAR
534,2023-03-13,1,Aricanduva/ Vila Formosa,Inativo Intransitável,16:43,18:38,R COMEN GIL PINHEIRO, AMBOS, R JULIO COLACO
535,2023-03-13,1,Aricanduva/ Vila Formosa,Inativo Transitável,17:19,19:19,a 19:19AV DR EDUARDO COTCHING, CENTRO/BAIRRO, R APIO CLAUDIO
536,2023-03-13,1,Itaquera,Inativo Intransitável,15:05,15:48,AV ITAQUERA, AMBOS, R CAMPINAS DO PIAUI
537,2023-03-13,1,Itaquera,Inativo Intransitável,16:08,17:01,R PADRE VIEGAS DE MENEZES, AMBOS, R ITAGIMIRIM
538,2023-03-13,1,Itaquera,Inativo Intransitável,16:32,17:48,AV ITAQUERA, AMBOS, R CAMPINAS DO PIAUI
539,2023-03-13,1,Mooca,Inativo Intransitável,15:55,17:28,R MELO FREIRE, AMBOS, R ITAPURA
540,2023-03-13,1,Mooca,Inativo Intransitável,16:01,16:52,R ADELINO DE ALMEIDA CASTILHO, UNICO, R AIAMA
541,2023-03-13,1,Mooca,Inativo Intransitável,16:01,17:25,R ADELINO DE ALMEIDA CASTILHO, UNICO, R AIAMA
542,2023-03-13,1,Mooca,Inativo Intransitável,16:03,01:53,R MARIA DOMITILA, AMBOS, R DA FIGUEIRA
543,2023-03-13,1,Mooca,Inativo Intransitável,16:08,17:21,R MONTE SERRAT, UNICO, R SERRA DE BRAGANÇA
544,2023-03-13,1,Mooca,Inativo Intransitável,16:18,17:48,AV ALCANTARA MACHADO, AMBOS, VD GUADALAJARA-JOAO BEHISNELIAN
545,2023-03-13,1,Penha,Inativo Intransitável,15:52,18:25,AV CD.DE FRONTIN, CENTRO/BAIRRO, AV ARICANDUVA
546,2023-03-13,1,Penha,Inativo Intransitável,15:57,17:48,AV CD.DE FRONTIN, CENTRO/BAIRRO, R PINHALZINHO
547,2023-03-13,1,São Mateus,Inativo Intransitável,16:29,20:40,AV ARICANDUVA, MARGINAL/ITAQUERA, R BAQUIA
548,2023-03-13,1,São Mateus,Inativo Intransitável,16:48,18:08,AV ARICANDUVA, ITAQUERA/MARGINAL, AV ITAQUERA
549,2023-03-13,1,São Mateus,Inativo Intransitável,16:52,20:31,AV ARICANDUVA, AMBOS, R JULIO COLACO
550,2023-03-13,1,Vila Prudente,Inativo Intransitável,15:31,17:07,AV PROF LUIZ IGNACIO ANHAIA MELLO, AMBOS, R IBITIRAMA
551,2023-03-13,1,Vila Prudente,Inativo Intransitável,15:39,18:48,AV VILA EMA, AMBOS, R ELIDIA MARIA DE JESUS
552,2023-03-13,1,Vila Prudente,Inativo Intransitável,15:41,17:00,PTE DO RIO TAMANDUATEI, IPIRANGA/SANTANA, R S CAETANO (BOM RETIRO)
553,2023-03-13,1,Vila Prudente,Inativo Intransitável,15:51,18:14,AV PROF LUIZ IGNACIO ANHAIA MELLO, AMBOS, R DOMINGOS AFONSO
554,2023-03-13,1,Vila Prudente,Inativo Intransitável,16:00,20:26,AV FRANCISCO FALCONI, AMBOS, AV PROF LUIZ IGNACIO ANHAIA MELLO
555,2023-03-13,1,Vila Prudente,Inativo Intransitável,16:38,18:05,AV PROF LUIZ IGNACIO ANHAIA MELLO, SAPOPEMBA/V PRUDENTE, AV SALIM FARAH MALUF
556,2023-03-13,1,Vila Prudente,Inativo Intransitável,16:40,18:05,AV PROF LUIZ IGNACIO ANHAIA MELLO, SAPOPEMBA/V PRUDENTE, R AMERICO VESPUCI
557,2023-03-13,1,M'Boi Mirim,Inativo Transitável,14:49,15:06,R MARGINAL (JD MARIANI), BAIRRO/CENTRO, AV COMEN SANT'ANNA
558,2023-03-13,1,M'Boi Mirim,Inativo Transitável,14:58,15:06,R CARMEM ESCABIA MOTTA COELHO, BAIRRO/CENTRO, AV CRISTIANO CLEMENTE DA SILVA
559,2023-03-13,1,M'Boi Mirim,Inativo Transitável,14:59,19:06,ES M'BOI MIRIM, BAIRRO/CENTRO, R ROBERTO SELMI-DEI
560,2023-03-13,1,M'Boi Mirim,Inativo Transitável,15:02,15:06,ES M'BOI MIRIM, BAIRRO/CENTRO, R DANIEL KLEIN
561,2023-03-13,1,M'Boi Mirim,Inativo Intransitável,15:15,16:00,AV ELLIS MASS, AMBOS, AV COM. SANT'ANNA
562,2023-03-13,1,Santo Amaro,Inativo Transitável,15:12,19:28,AV JORN ROBERTO MARINHO, MARGINAL/AEROPORTO, VD ENG ANTONIO MOLITERNO
563,2023-03-13,1,Santo Amaro,Inativo Transitável,15:19,18:05,AV INTERLAGOS, AMBOS, R ENG ALLYRIO HUGUENEY DE MATTOS
564,2023-03-13,1,Santo Amaro,Inativo Intransitável,15:21,18:05,AV INTERLAGOS, BAIRRO/CENTRO, AV YERVANT KISSAJIKIAN
565,2023-03-13,1,Santo Amaro,Inativo Transitável,15:25,17:16,MARGINAL PINHEIROS INTCB, INTERLAGOS/CASTELO, AV JOAO DORIA - 200M ANTES
566,2023-03-13,1,Santo Amaro,Inativo Transitável,15:27,15:53,AV DAS NACOES UNIDAS, INTERLAGOS/CASTELO, PTE ENG ARY TORRES
567,2023-03-13,1,Santo Amaro,Inativo Transitável,15:44,17:59,AV DAS NACOES UNIDAS, INTERLAGOS/CASTELO, R VERBO DIVINO
568,2023-03-13,1,Santo Amaro,Inativo Transitável,15:55,19:28,AV JORN ROBERTO MARINHO, AMBOS, AV STO AMARO
569,2023-03-13,1,Santo Amaro,Inativo Transitável,16:04,18:58,AV DAS NACOES UNIDAS, INTERLAGOS/CASTELO, AV INTERLAGOS
570,2023-03-13,1,Santo Amaro,Inativo Intransitável,16:52,18:26,AV DAS NACOES UNIDAS, INTERLAGOS/CASTELO, R FLORIDA
571,2023-03-13,1,Santo Amaro,Inativo Intransitável,16:57,17:35,AV DAS NACOES UNIDAS, INTERLAGOS/CASTELO, R B 18 (JURUBATUBA-CGR)
572,2023-03-13,1,Ipiranga,Inativo Transitável,05:59,06:45,R PEDROSO LOUSANO, BAIRRO/CENTRO, R BARRETO MUNIZ
573,2023-03-13,1,Jabaquara,Inativo Intransitável,15:15,16:30,R JORGE DUPRAT FIGUEIREDO, AMBOS, ALTURA DO N. 15
574,2023-03-13,1,Vila Mariana,Inativo Transitável,15:25,15:28,AV PROF ABRAAO DE MORAIS, AMBOS, AV FAGUNDES FILHO
575,2023-03-13,1,Vila Mariana,Inativo Transitável,15:25,15:28,AV PROF ABRAAO DE MORAIS, AMBOS, AV FAGUNDES FILHO
576,2023-03-13,1,Vila Mariana,Inativo Transitável,15:25,17:35,AV DOS BANDEIRANTES, MARGINAL/IMIGRANTES, R CD.DE PORTO ALEGRE
577,2023-03-13,1,Vila Mariana,Inativo Transitável,16:11,17:38,AV VINTE E TRES DE MAIO, AEROPORTO/SANTANA, PC DA BANDEIRA
578,2023-03-13,1,Vila Mariana,Inativo Transitável,16:42,17:29,AV IBIJAU, AMBOS, AL JAUAPERI
579,2023-03-14,1,Pirituba/Jaraguá,Inativo Intransitável,08:20,08:36,ES TURISTICA DO JARAGUA, AMBOS, R SEM DENOMINACAO
580,2023-03-14,1,Santana,Inativo Intransitável,08:56,10:24,AV CRUZEIRO DO SUL, SANTANA/IPIRANGA, R GUAPORE
581,2023-03-14,1,Santana,Inativo Transitável,08:59,10:24,AV CRUZEIRO DO SUL, SANTANA/IPIRANGA, R PAULINO GUIMARAES
582,2023-03-14,1,Santana,Inativo Transitável,09:02,10:24,AV CRUZEIRO DO SUL, NAO INFORMADO, R TAPAJOS
583,2023-03-14,1,Lapa,Inativo Intransitável,05:58,09:47,R VLADIMIR HERZOG, AMBOS, R CARLOS SPERA
584,2023-03-14,1,Lapa,Inativo Intransitável,15:37,16:49,AV POMPEIA, POMPEIA/MARGINAL, R VENANCIO AIRES
585,2023-03-14,1,Lapa,Inativo Intransitável,15:53,16:49,R VENANCIO AIRES, AMBOS, R RAUL POMPEIA (PERDIZES)
586,2023-03-14,1,Lapa,Inativo Intransitável,16:27,18:52,PC PASCOAL MARTINS, LAPA/B FUNDA, AC A AV MARQUES DE SAO VICENTE
587,2023-03-14,1,Itaquera,Inativo Intransitável,15:28,15:54,AV ITAQUERA, AMBOS, R CAMPINAS DO PIAUI
588,2023-03-14,1,Itaquera,Inativo Intransitável,15:43,16:29,R PDE VIEGAS DE MENEZES, AMBOS, AV CAMPANELLA
589,2023-03-14,1,Penha,Inativo Intransitável,15:14,15:17,R DR LUIZ AYRES, UNICO, AV PDE SENA FREITAS
590,2023-03-14,1,Capela do Socorro,Inativo Transitável,05:06,05:23,AV ATLANTICA, CENTRO/BAIRRO, AV JOAO DE BARROS
591,2023-03-20,1,Lapa,Inativo Intransitável,17:35,18:14,AV MOFARREJ, AMBOS, AV DR GASTAO VIDIGAL
592,2023-03-27,1,Santo Amaro,Inativo Intransitável,02:15,02:38,AV DAS NACOES UNIDAS, INTERLAGOS/CASTELO, R OLIVIA FEDER
593,2023-03-29,1,Itaquera,Inativo Intransitável,16:41,16:47,AV ITAQUERA, BAIRRO/CENTRO, R CAMPINAS DO PIAUI
594,2023-03-29,1,Vila Mariana,Inativo Intransitável,16:27,17:30,AV ITACIRA, AMBOS, R CAMPINA DA TABORDA
595,2023-03-31,1,Itaquera,Inativo Intransitável,13:52,14:23,AV ITAQUERA, AMBOS, R CAMPINAS DO PIAUI
596,2023-03-31,1,Itaquera,Inativo Transitável,13:54,14:30,AV ARICANDUVA, IQ/MARG, AV AFONSO DE SAMPAIO E SOUZA
597,2023-03-31,1,Itaquera,Inativo Transitável,14:46,15:12,AV ITAQUERA, AMBOS, R CAMPINAS DO PIAUI
598,2023-03-31,1,Mooca,Inativo Transitável,14:48,15:48,a 15:48R ENG CESTARI, AMBOS, AV VER ABEL FERREIRA
599,2023-03-31,1,M'Boi Mirim,Inativo Transitável,14:10,14:48,AV GUARAPIRANGA, AMBOS, AV GUIDO CALOI
600,2023-03-31,1,Santo Amaro,Inativo Transitável,14:02,14:31,AV DAS NACOES UNIDAS, INTERLAGOS/CASTELO, AV INTERLAGOS
